post_id	text	date	num_comments	num_likes	num_reposts	attachment_types
147913	Поиски «потерпевших» для фабрикации очередного дела на Алексея Навального продолжаются. Следственный Комитет планирует опросить тысячу человек. Напомним, СК уже опросил 150 человек, переводивших деньги на избирательную кампанию Навального, но так и не нашли ни одного, кто согласился бы написать заявление.	2015-04-16 07:25:05	12	138	35	photo,link
147906	«Ведомости» сделали подборку приговоров сотрудникам Фонда по борьбе с коррупцией. Как показала практика, борьба с коррупцией в нашей стране наказуема.	2015-04-16 01:30:00	6	183	21	photo,link
147894	Борьба за #20 продолжается. В прошлую среду мы опубликовали инструкцию о том, как в рамках кампании #Двадцать можно внести законопроект о незаконном обогащении в Госдуму через региональный парламент, и всего за несколько дней на на призыв откликнулись сторонники из 19 регионов! Присоединяйтесь и вы!	2015-04-15 23:45:33	2	79	11	photo,link
147883	«Коммерсант» пытался разобраться, почему, несмотря на все громкие заявления и меры по оптимизации бюрократической машины, общее число чиновников на деле год от года лишь увеличивается.	2015-04-15 22:00:51	2	70	13	photo,link
147871	Отличное, как, впрочем, и всегда, расследование «Новой газеты» о том, каким образом предприятие-«национальное достояние» разыгрывает свои тендеры. И как средства распределяются между участниками производственно-пищевой цепи, ведь аппетитом обладает каждое промежуточное звено.	2015-04-15 21:00:32	2	39	6	photo,link
147855	Суд отказался освободить экоузника Е.Витишко по УДО, сославшись на наличие у того взысканий от колонии. Причины взысканий: отдал свою куртку замерзающему заключенному, не поздоровался с сотрудником администрации колонии, делал замечания ругающимся матом охранникам.	2015-04-15 20:00:56	10	168	56	photo,link
147836		2015-04-15 19:01:01	14	107	18	photo,link
147831	По факту растраты бюджетных средств при строительстве научной библиотеки Северного Арктического Федерального Университета на сумму 15,5 млн рублей открыто уголовное дело. Отметим, что этого уголовное дело — уже третье по счету. Ранее были обвинены ректор и проректор САФУ. Последний даже осужден.	2015-04-15 18:00:46	4	41	7	photo,link
147814	КПРФ в канун очередного Дня Победы завесила весь Магадан плакатами со Сталиным. Им «Сталинобуса» было мало, что ли?	2015-04-15 17:00:41	38	34	9	photo,link
147784	Сенаторы опубликовали данные о своих доходах за прошлый год.	2015-04-15 16:01:05	18	38	5	photo,link
147774	В то время, пока сознание многих россиян пребывает в летаргической дреме, Михаил Ходорковский вынужден читать лекцию под названием «Россия: назад в будущее» в Стенфордском университете. Тем более, что зритель оказывается благодарным.	2015-04-15 15:00:11	20	66	10	photo,link
147758	Ранее мы писали, что убытки Первого канала за прошлый год составили около 1 млрд рублей. На сей раз СМИ стала известна величина задолженности перед производителями телеконтента — это более 7 млрд.	2015-04-15 14:01:07	4	60	12	photo,link
147733	Перфекционизм — это неплохо. Но всегда ли он уместен? Власти Москвы объявили конкурс на благоустройство Триумфальной площади. Начальная стоимость контракта — 360 млн рублей.	2015-04-15 13:00:22	25	22	3	photo,link,poll
147718	Начальника управления строительства ОАО «Мосинжпроект», генподрядчика строительства новых станций московского метрополитена, задержали за получение взятки.	2015-04-15 11:30:05	4	37	4	photo,link
147675	Цифра дня — сколько россиян откладывают деньги на случай увольнения.	2015-04-15 09:00:17	28	27	5	photo,link,poll
147669	Вчера суд вынес приговор по «плакатному делу»: сотрудника ФБК Георгия Албурова приговорили к 240 часам общественных работ. Читайте репортаж «Медузы» с суда — там трэш и угар.	2015-04-15 07:30:11	3	56	9	photo,link
147659	Если вы возмутились словам Пескова, что сайт Кремля стоит 50 млн руб, то возмущайтесь сильнее, он стоит 137 миллионов. Расследование Андрея Мищенкова: часть 1 http://ipasserby.livejournal.com/46886.html и часть 2 http://ipasserby.livejournal.com/47156.html.	2015-04-15 01:30:02	3	194	55	photo
147638	Почему печальный опыт лесных пожаров ничему не учит россиян? Читайте большую аналитическую статью «Йода» и «Гринпис». От себя добавим, что до 2007 года за пожарную безопасность в лесах отвечала единая структура — Гослесохрана, в штате которой было примерно 70 000 лесников-обходчиков и около 130 000 других работников лесного хозяйства. Но с принятием нового Лесного кодекса Гослесохрану упразднили, а ее функции распределили между чиновниками и частными арендаторами. А ведь власть предупреждали...	2015-04-14 23:15:09	8	77	22	photo,link
147616	Читайте большое интервью Валерия Спиридонова — первого в мире человека, которому предстоит операция по пересадке головы. Его на месяц введут в кому, температуру организма снизят, через нервные волокна будет проходить низкий электрический ток, а для стимулирования их сращивания применят особый химический состав биогеля. Подобным образом уже возвращали подвижность собакам с перебитым позвоночником: сработало.	2015-04-14 22:15:07	16	56	12	photo,link
147608	Всем нам известно это чувство печали	2015-04-14 21:44:18	11	173	14	photo
147600	Фонд борьбы с коррупцией ранее направлял письмо вице-премьеру Рогозину с тем, чтобы тот дал нам разъяснения по вопросу явно не обошедшегося без коррупционной составляющей ребрендинга концерна «Калашников». Цена сайта завышена в 64 раза, при этом техзадание не выполнено, контракт ушел «своим» людям, причем за месяц до решения УФАС, ну и т.д. И вот, наконец, мы получили ответ. Хмм...	2015-04-14 21:00:20	3	69	17	photo,link
147587	Россия потратит на повышение зарплат в Абхазии более 500 млн. руб.	2015-04-14 20:00:44	9	110	26	photo,link
147573	РБК: У Минфина не хватает 26 миллиардов рублей для оплаты внутреннего долга.	2015-04-14 19:00:17	5	44	8	photo,link
147526	По какой причине люди так боятся признавать позорные страницы истории своей страны? Нужно назвать геноцид – геноцидом, репрессии – репрессиями, преступление – преступлением. Это первые шаги к тому, чтобы взять на себя ответственность за неповторение подобных трагедий. Чтобы кровь предков не пролилась напрасно. Чтобы эти жертвы не оказались бессмысленными, так ничему и не научив потомков.	2015-04-14 18:01:01	6	111	23	photo,link
147458	Ребята из БлогСочи.ру прогулялись по поселку-призраку, который был построен 3 года назад и предназначался для граждан, попавших под олимпийское расселение. Однако граждан там практически нет, а сама территория пригодна для съемок о том, что будет, если человек вдруг исчезнет с лица земли.	2015-04-14 17:00:33	9	120	26	photo,link
147385	Силуанов потребовал как можно скорее повысить пенсионный возраст.	2015-04-14 15:55:10	45	144	46	photo,link
147330	Депутат без иммунитета. Партиец без партии. Гражданин, официально не имеющий возможности вернуться в Россию. Илья Пономарев дал большое интервью спецкору «Новой газеты», ответив на вопросы о событиях, касающихся всей страны и его лично.	2015-04-14 15:03:21	18	61	11	photo,link
147233	СК говорит, что пчелкинг — это халатность (ст. 293 УК) и развратные действия (ст. 135 УК).	2015-04-14 13:25:11	238	72	16	photo,link
147211	«Плакатное дело», по которому Г.Албурова приговорили к 240 ч. обязательных работ, было полно нелепостей. Так, судебные эксперты на полном серьезе утверждали, что существует некоторое портретное сходство персонажа «Хороший человек» с А.Навальным. Даже экспертизу к материалам дела присовокупили. От себя скажем: если уж на то пошло, то и прокурор по «Плакатному делу» кого-то напоминает.	2015-04-14 12:53:19	15	138	23	photo,link
147205	Судья вынес приговор Албурову — 240 часов обязательных работ.	2015-04-14 12:34:07	21	92	22	photo,link
147192	Началось оглашение приговора по «плакатному делу». Признали виновным. Судья повторяет слова прокурора почти дословно. Прямая трансляция: https://www.youtube.com/watch?v=-O_Ol2KLk7A	2015-04-14 12:06:25	9	69	19	photo,link
147178	«Власть в России сейчас — политические гастарбайтеры, которые приезжают сюда воровать, а свои семьи, свои счета, свою недвижимость держат за границей». Жора — молодец. Посмотрите сами и передайте другому. Сайт о «плакатном деле» здесь: http://delo.alburov.ru/	2015-04-14 11:24:18	14	192	62	video
147160	За кражу плаката с забора прокурор просит наказать Албурова на 3 года условного срока. Многие отреагировали так: ну условно — это хорошо. Но три года условно — это крючок для невиновного человека, когда в любой момент времени по своему желанию ФСИН будет требовать замены условного срока на реальный. Так что не надо, пожалуйста, говорить «ну всё хорошо». Это нехорошо, и сам факт такого требования от прокуратуры — уголовное преступление.	2015-04-14 10:39:42	13	101	24	photo
147136	Удивительно, но этот очерк Б. Стругацкого про возможное возвращение фашизма был написан 20 лет назад. Вот одна цитата: «Знамена у вас будут не красно-коричневые, а — например — черно-оранжевые. Вы будете на своих собраниях кричать не «хайль», а, скажем, «слава!». Не будет у вас штурмбаннфюреров, а будут какие-нибудь есаул-бригадиры, но сущность фашизма останется, а значит, останется ложь, кровь, война...»	2015-04-14 09:00:25	6	203	53	photo,link
147125	Прямые выборы градоначальников — это попытка западных спецслужб дестабилизировать ситуацию в отдельно взятом месте. Такую ахинею на полном серьёзе несет и.о. мэра города Бердска, что под Новосибирском, который в результате выборов никаким мэром, понятное дело, не стал бы.	2015-04-14 07:30:06	12	141	35	photo,link
147104	Подведены промежуточные итоги «оптимизации» здравоохранения. Подсчитав процент смертности, власть заявила, что «ожидаемого роста эффективности и доступности медицинской помощи не произошло». Да ладно?!	2015-04-14 01:30:03	9	125	29	photo,link
147088	Пермский художник Александр Жунев нарисовал на стене одного из пермских домов картину «Распятый Гагарин», приуроченную к Пасхе, совпавшей с Днем Космонавтики. Как объяснил сам Жунев, его картина освещает многовековую борьбу науки с религией. Уже сегодня художник давал показания в полиции.	2015-04-14 00:33:37	17	156	34	photo,link
147031	Наверняка многие уже успели посмотреть нашумевший ролик про «оренбургского Винни-Пуха и его пчёл» в постановке местной танцевальной группы. И, как водится, бравый Следственный комитет не мог обойти подобное своим вниманием.	2015-04-13 23:37:22	76	50	4	photo,link,poll
147021	Большое исследование РБК на тему «Кому на Руси жить хорошо, а кому — не очень».	2015-04-13 23:00:04	8	52	16	photo,link
147008	Алексей Навальный обжаловал в ЕСПЧ решение по своей тяжбе с Ликсутовым. Напомним, в августе 2014 Люблинский суд Москвы вынес решение о том, что опубликованная Навальным информация об офшорах Ликсутова якобы является недостоверной. При этом суд без объяснения причин отказался рассмотреть подтверждающие достоверность информации документы.	2015-04-13 22:00:12	10	80	15	photo,link
146987	«Кремлебот недели!» — новая рубрика в паблике Команды. Тролли, фанатики и экстремисты регулярно оставляют здесь свои прекрасные комментарии, поэтому мы решили помочь им принести стране хоть какую-то пользу. Как известно, улыбка продлевает жизнь, так что читайте шедевры, голосуйте за лучшего кремлебота и делитесь постом. Мы будем смеяться последними)	2015-04-13 21:00:03	20	30	0	photo,photo,photo,photo,photo,photo,photo,photo,photo,poll
146985	Похоже, в телевизионной пропаганде, в отсутствие каких-либо значимых поводов для поднятия чуть подугасшего ура-патриотизма, наметился новый прием.	2015-04-13 19:30:05	1	73	22	photo,link
146967	Роскомнадзору разрешили проверять личную переписку пользователей в интернете. Соответствующее постановление 8 апреля подписал премьер-министр Дмитрий Медведев.	2015-04-13 18:00:32	14	63	18	photo,link
146963	Быть гражданским активистом в современной России, бороться с беззаконием, которое творится иной раз вокруг нас, — дело непростое. Непростое и опасное. Портал ОВД-инфо подготовил доклад о досудебных преследованиях людей, которым хватило смелости в полный голос заявить о своём несогласии с теми или иными событиями.	2015-04-13 17:00:43	4	55	11	photo,link
146943	Очередной факт-перевертыш, когда человек, занимая определенную должность, совершает противоправные деяния, прямо противоположные тому, что он по долгу службы обязан делать.	2015-04-13 14:01:05	5	87	12	photo,link
146926	В свете продуктовых антисанкций и импортозамещения, шагающего по стране, крупные торговые сети находятся под контролем. Так это преподносится. Однако свою выгоду терять никто не хочет, вот и вынуждены сети идти на различные ухищрения. По ссылке — как не дать себя обмануть.	2015-04-13 13:01:16	22	83	17	photo,link
146901	Справоросы предлагают создать реестр российского ПО, которому должен отдаваться приоритет. В случае закупок иностранного софта нужно будет представить обоснование его необходимости.	2015-04-13 11:05:07	20	21	2	photo,link
146879	Папа Франциск заявил, что три главных преступления ХХ века — это нацизм, сталинизм и геноцид армян. Второй пункт вызвал в российском интернете много возмущения. Напомним, российское официальное духовенство никогда не высказывалось против сталинизма. Напротив, в 2009 году патриарх Кирилл заявил, что вовсе не считает режим Сталина человеконенавистническим.	2015-04-13 09:00:47	42	173	34	photo,link
146876	The Guardian опубликовал большое эссе о приемах информационной войны, которую ведет Кремль.	2015-04-13 07:30:16	6	191	41	photo,link
146792	Похоже, ИП в такси решено окончательно добить. По новому законопроекту, внесенному в Госдуму, ответственность для таксистов, зарегистрированных как ИП, ужесточается. Так, за невыдачу пассажиру кассового чека таксисты будут обязаны платить штраф 20 тыс. руб, за отсутствие шашечек или опознавательного фонаря на крыше — 30 тыс. руб. Этак всех ИП распугают такими законами.	2015-04-12 23:00:17	69	51	13	photo,link
146783	Узника Болотной Леонида Развозжаева не отпустили на похороны матери.	2015-04-12 22:05:24	7	110	16	photo,link
146771	Конструктор Сергей Королёв — человек, благодаря которому СССР покорил космос. Однако от сталинских репрессий не уберегал даже талант. Королёва пытали, сломали обе челюсти и отправили на прииск Мальдяк в Магаданской области. В День космонавтики вспомним историю жизни великого человека.	2015-04-12 21:07:09	6	314	95	photo,link
146743	ОСАГО сегодня подорожало на 40%.	2015-04-12 20:01:50	20	86	29	photo,link
146711	Приглашенный на РБК эксперт рассказала об экономике и о том, как на нее повлияло присоединение Крыма. На вопрос, чем же всё закончится, ответила: «Помните старую присказку? Либо ишак, либо падишах...»	2015-04-12 19:01:08	22	129	33	video
146702	ПОПУЛЯРНАЯ ПОЛИТИКА<br><br>Наш Я-кошелек, на который мы собираем деньги на выпуск тиража "Популярной политики" в Иркутской области, добавлен на сайт газеты!<br><br>http://www.pop-politics.today <br><br>Путинизм построен на тотальной лжи. Помогите уничтожить право власти на дезинформацию — поддержите выпуск "Популярной политики" в Иркутской области.<br><br>Я-кошелек — 410012233159948	2015-04-12 17:53:25	4	50	6	photo
146694	«Путин и ЖКХ» — неизданное видео Бориса Немцова из проекта «Ложь путинского режима». Это видео по докладу Бориса Немцова «Коммунальные тарифы, Путин и «Газпром» было сделано ещё в июле 2014 года.<br>Выход его в эфир несколько раз откладывался, потому что все новости были забиты сообщениями о российско-украинской войне. Борис Немцов хотел дождаться возвращения интереса россиян к проблемам своей страны и выложить его. Но не довелось.	2015-04-12 14:01:03	4	198	77	video
