post_id	text	date	num_comments	num_likes	num_reposts	attachment_types
150024	Дворкович поручил банкам и министерствам помочь сети «Едим дома!» Сети национального фастфуда помогут кто чем может. Банки дадут денег, власти — помещения. То, что проектом такого масштаба займутся люди, не имеющие ни одного успешного проекта в этой области, власть абсолютно не смущает.	2015-04-24 14:08:23	18	92	20	photo,link
150015	Наверняка многие слышали о позорных выборах в Новом Девяткино, где победу своему кандидату ЕР обеспечила только мухлежом с досрочным голосованием. Сергей Кузин, победивший по факту, не опускает рук и продолжает выводить жуликов на чистую воду. Например, Сергея Бебенина, чья дочь учится в Лондоне, что является прямым нарушением закона о гостайне.	2015-04-24 11:30:08	21	72	16	photo,link
149994	Продуктовая инфляция в России оказалась в 17 раз выше европейской.	2015-04-24 09:00:52	10	171	38	photo,link
149987	Расследование Навального о дворце Путина: управляющие получили теплые государственные должности, дома, гражданство и банки.	2015-04-24 07:30:20	2	127	29	photo,link
149964	Прокурор потребовал дать Евгении Васильевой условный срок, лишить ордена почета и оштрафовать на миллион рублей. За ущерб на 800 млн.pуб. — самое то.	2015-04-24 00:03:55	20	176	47	photo,link
149954	Скощухи не будет, а неприкасаемых нет.	2015-04-23 23:00:20	9	63	7	photo,link
149949	Минюст Пермского края признал иностранным агентом уникальный по своей исторической ценности, единственный в своем роде музей политических репрессий «Пермь-36». Похоже, нас методично пытаются заставить забыть об ужасах сталинского режима, и это — очередной шажок к намеченной цели.	2015-04-23 22:00:22	3	193	52	photo,link
149941	Журналиста Первого канала сегодня поймали за поджиганием травы в Хакасии. Он объяснил, что поджигал, потому что ему нужно было снять фон.	2015-04-23 21:00:42	1	151	31	photo,link
149913	До очередного маразма додумались в Госдуме на пару с МВД. Они призывают бороться с бурно развивающимся рынком недорогих гостиниц — хостелов. По их мнению, они — рассадник пороков и худшее, что есть на свете. В связи с этим — опрос:	2015-04-23 20:01:20	32	48	14	photo,link,poll
149908	Долгие годы занимавший пост спикера Мосгордумы единоросс Владимир Платонов отказался от своей липовой докторской, чему немало поспособствовали чудесные ребята из Диссернета. Поздравляем их! А депутату хотя бы хватило совести (есть такая штука, хоть и на грани исчезновения), чтобы признаться и отозвать свою степень. Пример для всех пойманных на плагиате в научных работах, коих немало!	2015-04-23 19:00:53	0	98	15	photo,link
149894	Аналитик СМИ Стивен Эннис посмотрел выпуски новостей российских телеканалов и обнаружил в них намеренную дезинформацию и манипулирование сознанием зрителей.	2015-04-23 18:00:45	1	166	24	photo,link
149883	«Либералы развалили страну» и другие мифы о российской экономике —  в статье РБК. А мы предлагаем вам опрос на самый популярный миф из серии антирусского заговора.	2015-04-23 17:00:13	19	28	4	photo,link,poll
149870	Сечин тут разразился критикой в адрес Минприроды. Они, мол, западные санкции против него поддерживают. И еще одновременно лоббируют интересы частных нефтяных компаний. Не хочет Игорь Иванович шельфом арктическим делиться.	2015-04-23 16:01:00	12	49	5	photo,link
149846	Минфин все продолжает искать пути, как бы сэкономить на здравоохранении и образовании, урезать их финансирование. Несмотря на то, что становится от их действий только хуже. Вообще, это все напоминаем скороговорку про лавирование кораблей:	2015-04-23 14:00:56	3	54	12	photo,link
149816	Кадыров приказал стрелять в любых силовиков (хоть федеральных, хоть из других регионов), которые без согласования с властями Чечни будут проводить какие-то операции в республике. Видео удалили не отовсюду: https://m.youtube.com/watch?v=EZNm1dAr5Y0	2015-04-23 12:53:09	48	106	30	photo
149802	Заседание суда по изменению меры пресечения Алексею Навальному перенесено на 13 мая, 16.00. «Перенос состоялся по техническим причинам. Видимо, суд хочет соблюсти все формальные процедуры, что мы впоследствии не смогли обжаловать решение суда по процессуальным причинам».	2015-04-23 11:25:49	8	57	16	video,link
149765	У здания Люблинского суда, где будет рассмотрено дело Навального, усилены меры безопасности.	2015-04-23 09:49:54	18	55	5	photo,link
149747	Алексею Навальному могут заменить условный срок на реальный. Заседание по этому вопросу состоится сегодня в 10.00 в Люблинском суде.	2015-04-23 09:00:41	25	103	29	photo,link
149737	Наши планы: выборы в ГосДуму в 2016 году на базе ПАРНАС. Наши ближайшие планы: шесть избирательных кампаний в трех регионах: Калужская область, Костромская область, Новосибирская область. В каждом из этих регионов идут и областные, и городские выборы. Три очень разных региона, где мы обкатаем программы, подходы и технологии, которые можно будет применить в 2016 по всей стране.	2015-04-23 07:30:15	10	86	11	video,link
149711	Мало нам превращения милиции в полицию, нужно больше ада. Депутат от Справедливой России предложила переименовать МВД в ВЧК. Зачем эти промежуточные стадии, уж сразу — в НКВД, не надо стесняться.	2015-04-23 01:30:02	8	203	37	photo
149687	Коалиция партий Навального и Касьянова пойдёт на выборы в парламенты трёх регионов: Новосибирской, Костромской и Калужской областей. Первый этап — праймериз.	2015-04-23 00:00:30	15	93	5	photo,link
149672	Очередной физик-ядерщик арестован и отправлен в изолятор: 66-летнего Владимира Голубева обвиняют в разглашении гостайны. Это уже шестой ученый, которого посадили за «измену родине». На фото, например, выдающийся физик Владимир Данилов, крупнейший в России специалист по космической плазме, он отсидел 8 лет.	2015-04-22 23:00:05	19	90	27	photo,link
149669	«Ведомости»: Путинская система управления — это классическая система семейного бизнеса. Однако в мире большие семейные фирмы, которые плохо управляются, зачастую поглощаются небольшими инвестбанками. В России есть одна партия инвестбанковского типа — Партия прогресса Навального. Ключевое отличие инвестбанковской партии от прочих — это умение привлекать лучших из лучших. Как только Навальному удалось добраться до выборов, он показал, что может мгновенно завоевывать их, несмотря на очевидное неравенство в медийных, административных и финансовых ресурсах.	2015-04-22 22:00:20	12	203	30	photo,link
149666	С 2011 по 2015 года РФ потратила на патриотическое воспитание полмиллиарда, пишет журнал «Коммерсантъ-Деньги». В следующие пять лет эту сумму планируется увеличить втрое.	2015-04-22 21:00:23	3	40	5	photo,link
149662	В России о ветеранах ВОВ власти вспоминают один раз в год — в преддверии 9 мая. Зато о себе они помнят круглый год. Почитайте, как Управделами Президента, прикрываясь юбилеем Победы, распилили 18 миллионов на сувенирную продукцию для 2500 журналистов.	2015-04-22 20:00:30	1	90	32	photo,link
149657	Ребята из «Открытой России» побывали в пострадавшей от лесных пожаров Хакасии. Видео, фото и разговоры с волонтерами, помогающими людям.	2015-04-22 19:00:56	0	54	15	photo,link
149656	Интервью «Медузе» дочери контр-адмирала Вячеслава Апанасенко, застрелившегося в феврале 2014 года из-за отсутствия обезболивающих препаратов и попросившего в своей смерти «никого не винить, кроме нынешнего Минздрава и Правительства».	2015-04-22 18:00:48	0	54	16	photo,link
149650	У секретаря Совбеза Патрушева, видимо, начинается паранойя. Он призвал власти приграничных районов получше следить за границей с Украиной, опасаясь националистов. Ранее его беспокоили националисты финские.	2015-04-22 17:00:43	5	60	6	photo,link
149640	После недавних возмутительных новостей о сокращении на 2,2 млрд ущерба по делу Оборонсервиса и выходе из дела в качестве потерпевших одноименной структуры и Минобороны, СМИ стало известно, что недолго музыка играла на улице Васильевой.	2015-04-22 16:00:49	5	51	7	photo,link
149634	Зачастую случается так, что про при новой власти вскрываются огрехи старой. Что, впрочем, отнюдь не означает улучшения обстановки в регионе. Примерно так и произошло в Самарской области.	2015-04-22 15:00:40	0	31	5	photo,link
149626	Власть обнаружила, что фильтры Роскомнадзора легко обойти, и занялась разработкой файрвола с более широкими возможностями, на который понадобятся миллиарды рублей. В стране алкоголизм, наркомания, безработица, куча нищих. А они вбухивают миллиарды в борьбу с интернет-страничками.	2015-04-22 14:01:09	12	472	164	photo,link
149625	Депутатская командировка на курорт<br><br>Никак не успокоятся петербургские депутаты. Уже не знают - как денег бюджетных на себя потратить побольше. Уже и на автомобили служебные незаконно больше 100 миллионов потратили. Все им мало. Решили расширить просторы деятельности. В командировку собрались. На Кипр. Куда же еще ездить в командировки летом, как не на Кипр, правда?<br><br>http://suharev.livejournal.com/151114.html	2015-04-22 13:00:23	1	52	14	photo,audio,link
149600	Фоторепортаж из уральского Карабаша, где происходит экологическая катастрофа. Жители этого города редко доживают до 45, но продолжают работать на местном заводе.	2015-04-22 12:00:29	17	67	13	photo,link
149580	Европейский Союз собирается официально обвинить «Газпром» в нарушении антимонопольного законодательства.	2015-04-22 11:00:45	8	42	2	photo,link
149564	Госконтроль качества продуктов питания в России не выдерживает критики, считают эксперты.	2015-04-22 09:00:46	12	96	20	photo,link
149558	ВЦИОМ: ситуация в стране стала лучшей для россиян за последние пять лет.	2015-04-22 07:30:06	5	168	35	photo,link
149538	Лайвблог о дискуссиях в Сети: Коалиция растет. Навальный и «телочки», Ходорковский и «Яблоко».	2015-04-22 00:00:41	16	37	3	photo,link
149519	Создается впечатление, что чиновники перечитали комиксов и в их воспаленном сознании оппозиционеры — эдакие злодеи. Так, вслед за «поджигателями» появились «затопители»: власти Нефтеюганска сваливают вину за затопленный город на Ходорковского.	2015-04-21 23:00:05	24	95	18	photo,link
149507	Касьянов лоббирует «Список Немцова», в который войдут пропагандисты, ответственные за разжигание в стране атмосферы ненависти: Соловьев, Киселев, Мамонтов, Добродеев, Кулистиков и другие. Против них предлагается применить «закон Магнитского», то есть запретить им въезд в США и заморозить их тамошние активы.	2015-04-21 22:00:35	12	115	12	photo,link
149498	РБК собрал наиболее яркие цитаты премьер-министра, который сегодня отчитался перед Госдумой о проделанной правительством работе в 2014 году. Как работали, так и отчитался.	2015-04-21 21:01:21	8	50	11	photo,link
149484	Советовавший россиянам «меньше есть» депутат Гаффнер оказался должен почти 200 миллионов, узнали СМИ.	2015-04-21 20:01:00	2	114	27	photo,link
149470	Сечин уже шантажирует правительство. Требует денег для «Роснефти» из Фонда национального благосостояния до 1 июня.	2015-04-21 19:01:00	7	67	16	photo,link
149466	Почему ставка на традиционные энергоносители – проигрышная стратегия, рассказывает экономист, директор Института энергоэффективных технологий в строительстве Владимир Сидорович.	2015-04-21 18:00:04	2	53	6	photo,link
149453	Армии требуется не более четверти имеющихся призывников. Желающих служить на данный момент, вероятно, немногим больше. Таким образом, система уклонения от службы существует и процветает, ежегодно принимая от родителей миллиарды рублей. И словно всех все устраивает.	2015-04-21 17:00:49	5	77	8	photo,link
149429	Общественная благотворительная организация помощи беженцам и вынужденным переселенцам «Гражданское содействие» включена в реестр НКО — иностранных агентов.	2015-04-21 15:00:42	5	39	7	photo,link
149410	Никакое силовое ведомство не захочет быть отлученным от бюджетной кормушки. Вот и главе ФСКН Иванову приходится выдумывать себе очередные «ветряные мельницы» для борьбы. Сегодня глава ФСКН обвинил создателей «спайсов» в «цветных революциях».	2015-04-21 14:01:27	21	76	13	photo,link
149401	Ленточки, каждая вторая машина на улице едет «на Берлин», патриотические концерты... И на этом фоне — два миллиона бойцов, судьба которых неизвестна. Десятки тысяч до сих пор не похоронены. Мне рассказывали про фермера в Ленинградской области, который у себя на поле нашел останки погибших в большом количестве, бегал как ошпаренный от военкомата до администрации и обратно с просьбой помочь организовать захоронение, да так никого и не заинтересовал.	2015-04-21 13:00:52	7	117	31	photo,link
149391	Канал «Россия 1» планирует в эти выходные показать фильм, посвященный 15-летию нахождения Путина у власти. Не вдаваясь в подробности и зная стиль кремлевских каналов, это наверняка будет нечто вроде этого:	2015-04-21 12:00:38	13	136	16	photo,link
149349	Новосибирцы пишут, что у них на ГУМе вывесили огромный баннер, приуроченный к грядущему Дню Победы. Только вот на изображении почему-то красуются не ветераны, а местные депутаты. https://vk.com/typical_nsk?w=wall-32258596_2613234	2015-04-21 10:35:09	22	134	22	photo
149288	Росстат предложил штрафовать людей, которые откажутся принимать участие в переписи населения. Штраф подразумевается небольшой, от 100 до 300 рублей. По мнению агентства, эта мера должна резко снизить процент отказников.	2015-04-21 09:00:20	36	35	7	photo,link
149262	Демократическая коалиция. Уже шесть партий и конкретные планы.	2015-04-21 07:30:17	31	172	19	photo,link
149213	Споры вокруг пчёлкинга не утихают. В связи с чем мы хотим провести опрос: а вы бы разрешили своей дочери подросткового возраста (13-16 лет) танцевать тверк?	2015-04-21 01:30:02	84	36	7	photo,poll
149202	Либертарианская партия России приняла решение войти в коалицию оппозиционных партий, создаваемую на базе РПР-Парнас для участия в выборах 2015-2016 годов.	2015-04-20 23:55:09	10	96	8	photo,link
149194	Политические заключенные бывают разные. Дела некоторых находятся на слуху, но куда большее количество не получают широкой огласки. Владимир Акименков делает очень важное и нужное дело — помогает тем, кто за свои взгляды и противостояние власти оказался за решеткой.	2015-04-20 23:00:28	3	69	9	photo,link
149179	МЧС отказало волонтерам в помощи для Хакасии из-за того, что «все машины на Донбассе».	2015-04-20 22:01:08	10	248	73	photo,link
149170	Предприниматели не спешат раскрывать свои зарубежные активы в рамках принятого курса на деофшоризацию экономики. Для них уже и сроки сдвинули, и думают о всяческих поблажках, но повлияет ли все это на их решение — большой вопрос.	2015-04-20 21:00:27	2	32	2	photo,link
149165	Расследование «Ведомостей» на тему того, что среди крупнейших налоговых должников зачастую числится очень много власть имущих, пользующихся своим привилегированным положением, чтобы уклониться от платы по счетам.	2015-04-20 20:00:36	3	65	14	photo,link
149156	В полку удивительно талантливых детей российских чиновников прибыло. Сын первого вице-спикера ГД Александра Жукова Петр займется разработкой систем управления предприятиями. Импортозамещение софта, все дела.	2015-04-20 19:00:55	6	130	33	photo,link
149146	Что могли понять телезрители из прямой линии с Владимиром Путиным. Раздваивающаяся реальность: россияне на грани психического расстройства.	2015-04-20 18:00:54	8	55	8	photo,link
149127	Экологическая катастрофа на Истринском водохранилище. Оно почти пересохло. Осталась лишь протока шириной 1 метр.	2015-04-20 16:00:52	6	58	14	photo,link
149099	Тут Путин рассказал, что ему не нравится работать президентом.	2015-04-20 14:02:52	13	70	8	photo,link
149078	В России хотят создать реестр подкупавших чиновников фирм. Предполагается, что он поможет организаторам тендеров более тщательно подойти к выбору исполнителя.	2015-04-20 13:01:07	11	44	5	photo,link
